,article_name,content,file_id
10,AI Emerges as Crucial Tool for Groups Seeking Justice for Syria War Crimes,"AI Emerges as Crucial Tool for Groups Seeking Justice for Syria War Crimes


BERLIN—By most accounts,  has been the most documented war in history.
But that mammoth trove of evidence—millions of videos, photos, social-media posts and satellite imagery—doesn’t easily translate into accountability for crimes committed during the war.
So as the United Nations, European authorities and human-rights groups build war-crimes cases, they have turned to a novel tool: artificial intelligence.
With the regime of President Bashar al-Assad emerging largely victorious from , efforts to bring about some measure of accountability are gaining speed, largely in European courts.
Since the beginning of Syria’s conflict, activists on the ground risked their lives to document human-rights violations, from torture and attacks on protesters to indiscriminate rocket strikes .
A man inspected damage to a home in rebel-held Douma, Syria, in November 2017.PHOTO: BADRA/EPA/SHUTTERSTOCK
An unexploded cluster bomb that landed in the Douma home.PHOTO: BADRA/EPA/SHUTTERSTOCK
Now, AI and machine learning could play an integral role in bringing war criminals to justice for Syria by helping to sort through the huge trove of evidence, and serve as a model for investigations into other modern-day conflicts.
“You have a use of technology both to disseminate the information, capture it, and now to search it that is suddenly very different and changes the way you work,” said Catherine Marchi-Uhel, who heads the United Nations body tasked with collecting Syrian evidence and building cases.
The technology is aimed at helping process, organize and analyze the data and reduce the time human investigators spend sifting through terabytes of traumatic videos and images. AI algorithms help group videos of the same incident and weed out duplicates or unrelated images. Algorithms are also working on object recognition, finding all data relevant to a specific weapon to help build a case.
In 2017, Hadi al-Khateeb, founder of Syrian Archives, an independent human-rights group that has been archiving evidence since the start of the conflict, wanted to assemble a searchable database on all cluster munition attacks. Mr. Khateeb hopes the database will help build a case that the Syrian regime and its main military backer, Russia, used internationally banned weapons during the conflict.
But it was impossible for Mr. Khateeb’s small team to sort through more than 1.5 million videos by hand to find all those related to cluster bombs.
A model of a cluster bomb in Mr. Harvey’s lab.PHOTO: MARZENA SKUBATZ FOR THE WALL STREET JOURNAL
In some cases, the technology to sort through the evidence exists but is too expensive for human-rights groups. More often, the technology to enable machines to recognize the image or sound of cluster munitions or other weapons of war doesn’t exist and needs to be built.
So Mr. Khateeb turned to Adam Harvey, a software engineer based in Berlin who leads VFRAME, an open-source project focused on using machine learning to advance human-rights work, to build an AI detector capable of such a search.
Mr. Harvey expected a coding task on par with creating algorithms for Google image searches. But soon he realized he was missing a crucial component to train the AI: enough existing images and videos of the cluster bombs.
“In looking for these specific items in human-rights investigations you don’t have as many of these as say cats on the internet,” Mr. Harvey said.
So Mr. Harvey spent more than a year creating synthetic data including 2-D images meant to replicate the environments in Syria and using 3-D models to recreate post-blast videos in various locations around Germany.
After training the program on this data, researchers test the accuracy of the algorithm by running it through a known set of images. They then tweak and retrain the data set to improve it.
In Mr. Harvey’s Berlin apartment, a wood drafting table is covered in gray, 3D-printed replicas of cluster bombs—primarily the AO-2.5RT—that were the most common munitions used in the Syrian war.
By mid-2021, Messrs. Khateeb and Harvey hope to have the database completed and ready to start building a case.
Elsewhere, ’s $40 million AI for Humanitarian Action project and a Silicon Valley nonprofit, Benetech, are also involved in the search for evidence of cluster-munition use.
As part of that effort, Microsoft completed a weapons-identification system code last year that searches and detects videos related to cluster munitions—as well as cannon fire, general explosions, U.S. TOW antitank missiles and sirens—based on sound. Cluster bombs have a distinctive popping sound when they explode.
Early on, human-rights activists believed that showing the international community—which had limited access to the country—what was happening would lead to an intervention against the regime of Mr. Assad. But that didn’t occur.
Now with international attention turning toward accountability, that trove of documentation is proving to be unprecedented in its size and variety in the annals of war-crimes prosecutions, according to the U.N.’s International Impartial and Independent Mechanism.
Catherine Marchi-Uhel heads the U.N.’s International Impartial and Independent Mechanism, the body tasked with collecting evidence and building cases.PHOTO: NICOLAS RIGHETTI FOR THE WALL STREET JOURNAL
But a massive amount of documentation doesn’t easily translate into justice.
“Videos don’t speak for themselves, no matter how great the video seems to be, video is not going to win or lose cases in war crimes,” said Keith Hiatt, who oversees information systems management at the IIIM. “Videos can’t show how widespread and systematic attacks are.”
Without the technology, “there would be no way to do it,” he added.
The IIIM is using machine-learning software to scan through hundreds of thousands of Arabic-language documents—much of them low-quality images—extracting patterns that are relevant to war crimes, such as official stamps, letterheads or signatures.
Keith Hiatt oversees information-systems management at the IIIM.PHOTO: NICOLAS RIGHETTI FOR THE WALL STREET JOURNAL
In building the cases, investigators need to establish not only the evidence that war crimes were committed, often found in videos and photos, but also the chain of command that led to those crimes, often found in documents smuggled out of Syria.
“It’s the [only] way that the U.N. would have a chance to be able to make sense of a conflict…as complex as Syria,” he added. “It’s too big to do it the old way.” Members of the IIIM liken it to searching for a needle in a stack of needles.
Compared with the enormous amount of electronic evidence from the Syrian conflict, the international tribunal for the war in the former Yugoslavia had some nine million documents—enough to fit on one modern hard drive.
The IIIM team working on the Syria case includes “e-discovery officers,” in addition to lawyers, investigators and analysts. Some such as Ms. Marchi-Uhel, a former French judge who worked on the international tribunal for the former Yugoslavia, while others worked on the Enron trial.
In Europe, there are dozens of cases and investigations into crimes committed during Syria’s war but none have relied on AI in building their cases. In October, three groups filed a joint complaint in Germany over two chemical-weapons attacks.
Most of the cases have prosecuted people—often low-level government officers or rebel fighters—for torture or detention and have been based in large part on witness testimony of Syrian refugees now living in Europe, Mr. Khateeb said.
But building bigger cases, including the systematic use of cluster munitions, requires more visual evidence found in the archives of groups like his.
Experts say using machine learning will inevitably raise legal questions and challenges—much like fingerprint and DNA evidence did when it was first introduced—but how those will play out won’t be known until cases where the technology is central begin going to trial.
“With any new type of analysis there will always be some lead time for acceptance,” said Carmen Cheung, executive director of the Center for Justice and Accountability. “And we won’t know what issues can arise in the courtroom until the first case where AI and machine learning has played a role.”
https://www.wsj.com/articles/ai-emerges-as-crucial-tool-for-groups-seeking-justice-for-syria-war-crimes-11613228401",10
11,Simulations with Quantum Chemistry,"The ultimate goal of computational quantum chemistry is to tackle the quantum effects that determine the structure and properties of molecules. Reaching this goal is challenging since the energies associated with these effects are typically a tiny fraction of the total energy of the molecule. One of the applications of computational quantum chemistry is the study and design of drugs that block different stages of the virus's life cycle. These types of drugs are called anti-retrovirals and they specifically bind with and block a virus protein or protease. With the protease blocked, the virus cannot make more copies of itself. It is important to perform chemical simulations to confirm that anti-retrovirals bind with the virus protein. However, such simulations are hard and sometimes ineffective on classical supercomputers.
 
Quantum chemistry for HIV
 
HIV is a virus that has presented a global challenge for public health. This virus has an impact on multiple societal dimensions including nutrition, access to health, education, and research funding. To compound the difficulties,  the virus mutates rapidly with different strains having different geographic footprints.
 

 
Current supercomputers lack the ability to simulate HIV molecules and hence no treatment has been generated so far. However, quantum computers promise more accurate simulations allowing for a better drug-design workflow. For instance, the Variational Quantum Eigensolver (VQE) is an algorithm for finding the ground-state of a molecule and simulate other chemical phenomena.
 
How does the VQE algorithm work?
 
The inputs to the  are a molecular Hamiltonian and a parametrized circuit preparing the quantum state of the molecule. If you’re not a physicist, your most probable reaction will be: “what is that?!” Fortunately, you don’t need to know about quantum physics to understand VQEs. So, let me put it into other words. VQE is a hybrid quantum-classical algorithm, which means that the algorithm consists of two stages: a quantum and a classical stage. The output is an approximation of the combination of values that solve a given optimization problem.
 

 
During the quantum stage, a trial molecular state is created on the quantum computer. The trial state is specified by a collection of parameters which are provided and adjusted by the classical stage. After the trial state is created, its energy is calculated on the quantum computer. During the classical stage, a classical optimization algorithm looks at the previous energy levels and the new energy level and decides how to adjust the trial state parameters.
This process repeats until the energy essentially stops decreasing. The output of the whole algorithm is the final set of parameters that produces the winning simulation of our molecule and its chemical properties. Using this algorithm, scientists could find the anti-retrovirals that block the HIV virus among many other viruses that are computationally expensive to simulate.
 
But… what else?
 
Simulating molecules is only one of the multiple applications that the VQE algorithm offers. Its power is also extended to areas such as  and Artificial Intelligence (AI). These fields rely on processing huge amounts of complex datasets. There is also a need to evolve algorithms to allow for better learning, reasoning, and understanding. While some ML and AI algorithms would take years in a classical supercomputer, a quantum computer would solve it in a matter of seconds using VQE’s. To wrap up, quantum computers are leading the way to the next generation of computers by increasing computational capability and power. With algorithms such as VQE’s, fields such as computational chemistry, AI and Machine Learning will enter a new era of power and speed.
 
References
 
• Pennylane.ai. 2021. A brief overview of VQE — PennyLane. [online] Available at: <https://pennylane.ai/qml/demos/tutorial_vqe.html> [Accessed 3 October 2021].
• 2021. [online] Available at: <https://towardsdatascience.com/the-variationalquantum-
eigensolver-explained-adcbc9659c3a.> [Accessed 3 October 2021].
• Qiskit.org. 2021. Simulating Molecules using VQE. [online] Available at: <https://
qiskit.org/textbook/ch-applications/vqe-molecules.html> [Accessed 3 October
2021].",11
12,Despliegue y arquitecturas en AI,"Lo que debe saber sobre despliegue y arquitecturas de solución en Inteligencia Artificial
 
Este artículo aborda las consideraciones de arquitectura para el despliegue y arquitecturas de solución en AI. Está orientado a personas o equipos que se encuentren interesados en iniciar un proyecto de dicha naturaleza, e incluso también es una guía para aquellos que consideren iniciar en un ambiente de pruebas.
Es importante no perder de vista que la inteligencia artificial hace parte de un sistema más grande y que entre sus funciones está apoyar objetivos de negocio específicos. Desde luego es una ciencia que debe ser integrada con otros sistemas nuevos y legados. Para este caso, vale la pena mencionar que la tarea del científico de datos debe incluir estas preocupaciones.
La inteligencia artificial se centra en  que permitan hacer inferencia sobre escenarios definidos. Las técnicas usadas en este tipo de estudios están cobijadas bajo el término “Data Science”.
 
Ciclos de experimentación en inteligencia artificial
 
 Un ciclo de experimentación en inteligencia artificial se compone de tres acciones fundamentales: idear, programar y experimentar. Los Jupyter Notebooks, por ejemplo, son una herramienta que permite apoyar estos ejercicios de experimentación en ambientes en la nube. En términos generales, los notebooks son documentos que contienen una mezcla de markdown (Lenguaje de marcado para documentación) y código ejecutable en vivo en lenguajes de programación  como Python o R.
Estos ejercicios son interesantes, debido a que permiten generar resultados con gran agilidad, pero pierden visibilidad por numerosas razones, la principal de ellas es que este tipo de ambiente es experimental. Por lo anterior, haré hincapié en algunas consideraciones importantes que hay que tener en cuenta a la hora de desplegar soluciones de inteligencia artificial, con el fin de que se conviertan en una herramienta útil de las organizaciones que deseen implementar esta ciencia.
 
Soluciones de inteligencia artificial
 
Un modelo de machine learning eventualmente se convierte en una caja negra que, dado un input de datos, genera un output con la inferencia (que puede ser una predicción, una clasificación, etc.). Esto pasa ya sea, aplicado a un sistema de predicción como el clásico ejemplo de los precios de las viviendas, que dadas características como el tamaño (área construida o habitable), el número de baños, la localización geográfica entre otras cosas permite predecir el precio del inmueble. También podemos verlo en los ejemplos de visión por computadora como el clasificador de gatos y perros que recibe como input una imagen y determina si contiene un gato o un perro. Así mismo, podemos encontrarlo en un chatbot que recibe el input de conversación de un usuario y retorna la respuesta adecuada de acuerdo a su intención.
 


 
Uso y necesidad de usuarios de soluciones AI
 
Teniendo en cuenta este hecho, es más fácil entender qué se quiere hacer con el despliegue de una solución de AI. Ahora puede pensar más en la forma del input de su modelo, ¿se trata de un sistema de respuesta inmediata, como en un chatbot, con una entrada de texto único? O ¿puede ser un sistema de conteo, donde el usuario puede cargar múltiples imágenes para ser procesadas en batch (procesamiento por lotes)?. Lo anterior pone en evidencia que independientemente del modelo, esta es una característica que está definida por el caso de uso y la necesidad de sus usuarios.
Con esto en mente, es momento de pensar en los recursos necesarios para ejecutar la predicción. ¿Su modelo requiere procesamiento que usa de forma intensiva los recursos de hardware?. Si es así, deberá ejecutar estos procesos sobre la GPU (unidad de procesamiento gráfico). ¿Está su modelo preparado para usarla? ¿Requiere que su predicción se haga en tiempo real? ¿Cuántos usuarios van a realizar predicciones? ¿Cuál es el volumen de los datos que van a pasar por el modelo?
Así, empezamos a encontrar algunas soluciones a las necesidades que de pronto ya está empezando a adoptar y que no tienen relación al entrenamiento de un modelo de machine learning, de redes generativas o de cualquier otra técnica de Inteligencia Artificial. Como lo dije anteriormente, un chatbot requiere respuesta inmediata y un manejo del estado de la intención. En este caso se hace preferible el uso de aplicaciones con estado. Si desarrolló su modelo en Python puede usar un framework como Flask o Django, también puede manejar el estado de la conversación desde el frontend y desplegar su modelo como un servicio sin estado al que debe recordarle constantemente el flujo de la conversación.
 


 
¿Qué es aconsejable para cada modelo?
 
En modelos de predicción y clasificación que no son intensivos en cómputo, es aconsejable manejar servicios web. Los contenedores, vistos como unidades de software que empaqueta el código y sus dependencias, son una forma fácil de desplegar este tipo de modelos en instancias que pueden ser escaladas vertical y horizontalmente. Normalmente los contenedores son desplegados sobre servicios de virtualización de costo continuo.
Si su modelo es para un uso más granular o si se trata de un modelo que se ejecuta como una tarea programada, se recomienda el uso de funciones en la nube. Las funciones en la nube son unidades de cómputo que se cobran por segundos de ejecución, en este tipo de servicios la preocupación no radica en la infraestructura, sino en la eficiencia del código.  Si se diera el uso continuo en el tiempo de este servicio, el costo sería mucho más alto que el de una virtualización tradicional.
 


 
Clusters de predicción
 
Por último, suponga que quiere hacer predicciones sobre los datos haciendo uso de un modelo con altos requerimientos computacionales, donde probablemente la predicción toma bastante tiempo en terminar. Una buena solución para este tipo de requerimientos es la creación de clusters de predicción, que no son más que grupos de máquinas virtuales que cumplen las características necesarias para la ejecución del modelo. Estos clusters son fácilmente escalables horizontalmente. La idea de lo anterior es registrar la tarea de predicción en un datastore (Base de datos, cola, etc.) de su elección, un nodo del cluster se apropia de la tarea y escribe el resultado de la predicción asociado a esta tarea.
Este tipo de arquitecturas de solución también es muy usado para la predicción en batch, por medio del uso de colas y definición de servicios sin estado. Las peticiones de los usuarios pueden cambiar de un servidor a otro. En este caso los servidores, nodos o contenedores de inferencia son vistos como trabajadores cuya función es sacar la siguiente tarea de la cola para hacer la inferencia. Nuevamente el resultado de la inferencia debe ser persistido con el registro de la tarea invocada.
 
Despliegues en la nube
 
Los proveedores de infraestructura en la nube como Azure, Amazon y Google tienen frameworks de desarrollo de machine learning, estos frameworks tienen las herramientas adecuadas para lograr este tipo de despliegues en la nube y se puede llegar a resultados muy interesantes de forma ágil. Sin embargo, la herramienta más útil es el registro de modelos. Un registro de modelos es simplemente un repositorio, donde es posible versionar y aprovisionar los modelos de machine learrning para ser desplegados fácilmente.
 
On the edge
 
Hablamos del despliegue de modelos en infraestructuras en la nube, pero también se puede deplegar modelos “on the edge”. Este tipo de despliegues es altamente usado en arquitecturas para IoT y para dispositivos móviles. Un ejemplo de este tipo de despliegues es el reconocimiento facial, que puede ser desplegado en dispositivos móviles o en dispositivos como Raspberry o Jetson.
Se trata del entrenamiento de modelos de forma tradicional y una conversión del modelo para el despliegue en dispositivos con menor capacidad computacional o con requerimientos energéticos especiales. Esta conversión del modelo desfavorece ligeramente la precisión de la inferencia y se hace posible por medio de librerías como Tensorflow. Sin embargo, no todos los modelos pueden ser convertidos y deben ser muy bien diseñados para lograr este cometido.
En el caso de Computer Vision, la mayoría de estos modelos detectan características genéricas de lo que se desea identificar o son modelos de clasificación aun limitados. No es común ver modelos que clasifiquen una gran variedad de personas en imágenes y que estén disponibles para todos los dispositivos móviles del mercado.
 


 
En conclusión
 
Para finalizar, quiero destacar que las ideas presentadas anteriormente, no son inherentes a esta área de trabajo, por el contrario, funcionan para todos los procesos que puedan consumir una cantidad prudente de recursos computacionales y de tiempo. De tal forma que, espero que pueda llevar a la realidad con mayor claridad las estrategias de su próximo proyecto de despliegue de AI. De la misma manera espero que tenga mayor capacidad de respuesta a inconvenientes que se presenten en la implementación de este.
¿Quiere saber más? Conozca nuestro",12
