,article_name,content,file_id
5,Robotics driven by artificial intelligence,"The branch of robotics has advanced significantly over the years, having applications in the industry, domestic services, medical field, among others. However, have you ever wondered why humans are afraid of some robots? Is humanity prepared for robotics driven by artificial intelligence?
Take a look at the following images. How do you feel about them? Maybe neutral? Maybe uncomfortable?
 

 
And what about these? Perhaps the sensations are better than the previous ones.
 

 
The strange but fascinating phenomenon of the Uncanny Valley
The sensations people feel with those images, including discomfort and calm, are caused by a strange phenomenon called Uncanny Valley. This concept was first introduced in the 1970s by Mashiro Mori, who attempted to describe his observations and feelings to robots that looked and acted almost like humans. He hypothesized that as robots appear more humanlike, they become more appealing, and people have more empathy with them, but only to a certain point [1]. When we reach that point (uncanny valley), the person's response would abruptly shift from empathy to revulsion, causing a tendency to be scared of the robot or causing feelings of strangeness or a sense of unease [2]. Besides robots, the phenomenon could appear in virtually created characters, such as the new metaverse.
For more information about the metaverse, you can read this 
Figure 1 shows the uncanny valley graph. The horizontal axis represents the robot (or virtual character) human likeness, and the vertical axis represents our affinity towards it. Nevertheless, the relation between those parameters is strange as the human likeness increases and becomes more evident when the robot moves.
 

Figure 1. Uncanny Valley graph
 
Why is it important to avoid the uncanny valley?
 
Nowadays, the usage of robotics in our daily life is booming [3]; however, whole interaction with machines has not been achieved due to the low affinity and empathy between humans and robots. Their limitations lead to an inevitable rejection when interacting in terms of expressing emotions. Therefore, it is a great challenge for this industry to naturally make robots part of the environment without reaching the uncanny valley.
One of the most visionary applications of robotics is related to education and rehabilitation. These applications are achieved with robots capable of simulating human emotions, which leads to an increase in the man-machine relationship. By accomplishing this, the education or rehabilitation of disabled people is possible since the patient will be able to create a specific empathic bond with his therapist. At the same time, the robot or virtual character will be able to develop his work in a more effective way [4].
Can AI help us to avoid the uncanny valley?
 
Yes, the short answer is yes. And you may be thinking that the answer is obvious, but it's not. Many companies related to this field continue creating super technological robots with considerable sensors, complex computer vision algorithms, advanced joints, etc. But forgetting one crucial but straightforward phenomenon, the uncanny valley, where many robots fall in, even the most advanced [5].
The problem is that it is thought that the more, the better, and this only applies to the use of artificial intelligence, not to the design of the robot. So, for example, when a robot with a complex design tries to emulate emotions with many facial expressions or large movements of its joints, no matter how complex its artificial intelligence models are, the result? The famous but unwanted uncanny valley.
The best example could be Ameca, a robot released in 2022 that uses Automatic Speech Recognition to recognize people's voices, Computer Vision to recognize faces and objects, among others [6]. However, in my opinion, it is a robot that will fail in its interaction with human beings due to its way of expressing emotions.
[embed]https://www.youtube.com/watch?app=desktop&v=JEBnQKxQYtE&ab_channel=SkyhoundInternet[/embed]
 
On the other hand, let's imagine a simple robot that can express emotions with just a few joints or by simple sounds, the empathy towards the robot will increase a lot. But that's not enough.
If we want to reach maximum familiarity with the robot, we need to use artificial intelligence, how? For example, using Automatic Speech Emotion Recognition to listen and understand what people are saying, Facial Emotion Recognition, or Computer Vision.
At the same time, robots could use emotions to accompany what they are saying, giving a personalized treatment depending on that emotion.
To have good examples, we need to find robots that emulate living things' emotions (animals or humans), with minimalist details or even without any human or animal trait. One of the best-known examples could be WALL-E, an animated robot that looks like a robot and can emulate emotions with just his movements and sounds. Another good example is , a little AI-powered robot capable of emulating emotions without any joint, just an LCD screen. 
 
[embed]https://www.youtube.com/watch?v=Qy2Z2TWAt6A&ab_channel=DigitalDreamLabs[/embed]
 
What's next?
 
As mentioned before, the branch of robotics has grown in recent years; although its most considerable daily use continues to be industrial robots, the other branches of robotics have also had significant growth.
What's the problem? Before creating any robot, we need to know its purpose well. If the tasks robots have to perform are related to human interaction and its design and technology aren't focused on that, the only thing that will happen is that there is a repulsion towards the robot by the human, and therefore, robot mission will fail.
To conclude, if you think that robots in the future will look like those in Terminator, I robot, Transformers, Surrogates, or anyone else who might cause discontent, the answer, in my opinion, is no. Instead, they will look like the robots of Star Wars or WALL-E, which show emotions simply and without causing us, terror.
 
References
Caballar, R. D. (2019). What Is the Uncanny Valley? IEEE Spectrum. https://spectrum.ieee.org/what-is-the-uncanny-valley
Mori, M. (2012). The Uncanny Valley: The Original Essay by Masahiro Mori. IEEE Spectrum. https://spectrum.ieee.org/the-uncanny-valley
Patiño, P., Moreno, I., Muñoz, L., Serracín, J. R., Quintero, J., & Quiel, J. (2012). La robótica educativa, una herramienta para la enseñanza-aprendizaje de las ciencias y las tecnologías. Education in the Knowledge Society (EKS). https://www.redalyc.org/pdf/2010/201024390005.pdf
Kaspar’s journey. (2017). Kaspar the Social Robot. 
Rankings-Creepiest-Robots - ROBOTS: Your Guide to the World of Robotics.. Robots.Ieee. 
Engineered Arts Ltd. (2021). AI vs. Human Intelligence. Engineered Arts. https://www.engineeredarts.co.uk/software/artificial-intelligence-vs-human-intelligence/",5
6,NLP la magia de las máquinas que entienden,"INGLÉS


This article NLP: the magic behind machines that understand us, talks about Natural Language Processing or NLP, a branch of knowledge between Artificial Intelligence and Linguistics that aims to give machines the ability to understand the language of humans.
 
NLP involves the analysis of the following:
1. syntax: identifying the syntactic role of each word within a sentence.
Example: in the sentence ""I will buy a candy"", ""I"" is the subject, ""candy"" is the direct object and ""I will buy"" is the verb.
2. Semantics: determining the meaning of words or phrases.
Example: in the sentence ""The engineer went to the customer's office"", the customer's office refers to a place.
3. Pragmatics: establish how the communicative context affects the meaning.
Example: in the sentence, ""David drank wine at the party. It was red."" Red refers to the wine David drank.
 
We perform these three analyses every day, some almost unconsciously. For us, deriving meaning from language turns out to be very simple and is the consequence not only of a process of development and learning but of thousands of years of evolution. Now, think how difficult it can be for a machine which only understands ones and zeros to understand your emotions when writing a review of a movie or a product you have purchased.
Among the most difficult challenges in NLP are dealing with ambiguous expressions, pragmatics and the implicit use of prior knowledge. Some sentences that show this kind of problem are:
- I will be on the beach with Mary reading. Are you reading, are you both reading or is she reading? (Ambiguity).
- We saw John walking. Did you see that John was walking, or did you see John when you were walking? (Ambiguity)
- The first sprint of the project took one month. The term sprint is technical language in project development (Prior knowledge).
Think how difficult it is for a machine to derive meaning from such sentences if we cannot derive meaning clearly.
 
WHAT GOOD ARE MACHINES THAT UNDERSTAND US?
 
Language is the primary way for humans to communicate effectively. Think that you use the language daily to perform tasks, make analyses, convey emotions and perform many other actions and needs of your life. Now think, what would happen if a machine that can perform tasks and activities thousands of times faster than you, could understand you, and not only you but thousands of people at the same time.
It is clear that the implications of a machine that understands natural language are fascinating. Here I will present some applications and systems that make use of NLP.
 
DIALOG SYSTEMS
 
These systems are divided into two main groups: task-oriented systems and chatbots. The former focus on accomplishing valuable tasks, while the latter focus on maintaining a conversation with the user without implementing any specific task.
The following image shows how these types of systems are divided according to whether they can perform practical tasks and maintain a complex social conversation. 
In many business environments, these terms are often confused as all companies ask to develop chatbots when they really want a task-oriented system.
Examples of task-oriented systems are virtual assistants such as Siri, Alexa and Cortana. Chatbots, on the other hand, are characterised by having defined personalities, carrying on entire conversations, and expressing emotions such as fear, temper, and distrust. The trend is to move toward virtual assistants with characters who can handle more complex social conversations yet are knowledgeable on many topics and can perform functional tasks.
 
TEXT CLASSIFICATION
 
This is the process of assigning categories to texts according to their content. Four of the most common applications of text classification are:
- Sentiment analysis: when you want to determine whether a text is negative, positive or neutral, or when you want to determine the predominant emotion in a text. This is widely used to analyse texts in social networks or product and service reviews.
- Classification of texts by topic: the objective is to understand what a given text is talking about or its main subject.
- Language detection: you want to determine a given text's language.
- Intention detection: it is widely used in customer service to classify customer responses according to their intention (interested, not interested, unsubscribe, potential buyer...).
 
INFORMATION EXTRACTION
 
This is the process of transforming unstructured information into structured data. The objective is to find important entities within a text (people, organisations, locations, etc.), discover their relationships, and store them in a data structure such as a relational database. The purpose of this is to structure the information so that better analysis can be performed, information can be reused, and better insights can be generated.
 
Information Retrieval Systems
 
Information Retrieval is the science behind search engines. It aims to bring users relevant information from unstructured sources such as text, images, videos and audio. The quintessential example of this type of system is the Google search engine. However, consider all the benefits your company could have if it had an ""internal Google"" that could bring relevant information to expose all documents, reports, emails and even social networks, according to search criteria that can be written as you normally as you express yourself.
 
AND WHERE'S THE ""MAGIC"" BEHIND IT?
 
All these NLP systems and applications are based on Machine Learning methods that seem, at first glance, very sophisticated. But how intelligent are these systems? To answer this question, you must first understand what is behind these systems. In general, there is no convention or a defined process to attack this type of project; however, here, I will state three tasks that are usually fundamental in many NLP applications.
The first one is to do POS Tagging (Part of Speech Tagging), which aims to assign a tag to each word in a sentence according to its syntactic role.
The second is to perform Dependency Parsing, which aims to analyse the grammatical structure of a sentence by establishing relationships between words.
The third is to perform Named Entity Recognition, which aims to find all relevant entities within a sentence. These entities can be people, organisations or places.
 
HOW ARE THESE TASKS PERFORMED?
 
These three tasks are performed automatically by Machine Learning models. It seems almost ""magic"" that we only have to pass plain text to these models so that they automatically perform these analyses, and we have the labels word by word. However, the reality is that these models are not so magical. All these Machine Learning models are supervised learning, meaning they learn based on many examples we humans must give them. The following example shows how a human must tag the syntactic role of each word (POS tag) in a sentence to provide the machine with an example of how it is done (the tags are in red, and each tag has a meaning):
The/DT grand/JJ jury/NN commented/VBD on/IN a/DT number/NN of/IN other/JJ topics/NNS ./.
 
Note that there is a tag even for the period!
 
This is a terribly tedious process. Now note that the example is only one sentence. For such models to automatically perform these tasks, the machines must learn from millions of sentences that a poor human must manually tag. Still, sounds very sophisticated?
There are already vast amounts of tagged documents freely available; however, the differences in the quality of tagging documents, the number of tagged documents and the variability of type of tagged documents between English and Spanish is abysmal, which makes Machine Learning models that automatically perform these tasks mentioned above much better in English than in Spanish or other langauges.
The truth is that, despite these limitations, very interesting, functional and valuable things can be done. The challenge is to understand what works, what doesn't and why, to know how to use the best tools, optimise their use and try to improve their performance for each specific business case.
 
What is the future?
 
The future dream in this field is to arrive at methods that do not need human examples or, at least, to reduce their dependence significantly. We want machines that do not need millions of examples of labelled word-by-word sentences to learn. 
It is already known that some methods allow machines to learn without needing examples. These are the methods behind the machines that play chess better than the great chess masters or those that beat the best gamers in the world in some video games. But can these methods be extrapolated to other areas of Artificial Intelligence, such as NLP? For example, can we reach machines that just by ""observing"" us talking, can understand what we say?",6
7,Shaping the metaverse,"A few months ago, I received a  newsletter in which, as if it were a chapter in Black Mirror, it affirmed the existence of a mixed physical-virtual universe called Metaverse. With intrigue, I searched on the internet and found out that  rather than a social media one, so they were  to work in it. Another news said that the video game developer and publisher Epic Games, owner of the popular Fortnite, got a  to develop their Metaverse. These companies and many more have followed the same vision. So, what is the metaverse? Why are these tech giants so interested in it? What does AI have to do with all of this? Well, I will tell you how both humans and machines are shaping the Metaverse.
 

 
What is the Metaverse?
 
To give you an idea about Metaverse, I will give you an example with films such as  or . In both, the characters live in an earthly world, like the one we live in. However, in both, the characters are aware that their reality has two worlds or realities which share the consequences of what happens in each other. For example, in Ready Player One, there is a virtual world called Oasis in which you access through gadgets that let you to live and interact with that world. In Avatar, there is the planet Pandora in which humans can transfers their consciousness through a capsule to a humanoid being living on the planet. These films show that what happens in Oasis or Pandora has a direct effect on the reality and it is because both the Oasis and Pandora have been merged into a single entity with our world. Today there is no clear definition to Metaverse but, for me, it is every experience that can be constantly shaping and replicating on both virtual and physical world, reprogramming beings and machines.
 

Ready Player One movie
These films can give a sense about some properties and characteristics that the Metaverse will address in the future and that have been mapped in a , highlighting 9 key characteristics:

Mapping the Metaverse by Wunderman Thompson
 
All these 9 ingredients will allow us to go further in our world, from a passive participation of digital content to a totally active and inclusive one, where each action we make will affect our physical and virtual environment simultaneously.
 
A human - machine tendency
 
But why large companies have invested so much in the development of this Metaverse? It is because the increase in social networks, entertainment, and technological advances such Blockchain and AI that have being immerse in our everyday activities.


The lockdown promoted and reassured the use of digital platforms as alternative means to entertain, socialize, shop, work and more. We have made these digital means part of us. This is reflected with data collected by  of the surveyed say that their now-a-days life is technology dependent. Jon Radoff, an American entrepreneur, explains in our lives through human-machine trends:
Virtual Mainstreaming: People tend to make the digital world to be as real as the physical world. If you've ever played Farmville on Facebook, or were on Haboo making friends, you will sense the feeling of reality in these games. Or to put other examples, Amazon adopted the way of shopping, or Netflix's watching movies from home. We are unconsciously using the digital version of what we do physically in the real world, and we love it. As Beth Kindig writes in her article for Forbes: ""If you experience moments where your virtual life online feels as real as your physical life, then you 've dipped your toe into the idea of a Metaverse.""
 

Avatars at the disco in Haboo
 
Simulating Reality: As Jon Radoff mentions in , we will go beyond the Internet of Things (IoT) to an Internet of Everything. Technological advances let us think that, in the coming years, machines will be able to acquire and process huge amounts of data from our world in real time, allowing the Persistent and Reactive properties mentioned in the . In addition, with the arrival of the , digital twins will allow us to simulate and explore in much more controlled environments better ways to optimize and operate real objects. This gives us the opportunity to simulate how a factory operates like in , how it feels to, or to generate .
 


 
Machine Intelligence: AI as the mainstay of the Metaverse
 
To make real the Metaverse, we need machines to understand us and be reactive to our interaction, and AI has the potential to achieve them. In fact, AI will have a key role being facilitator of interactions, participant within this universe and support for the human being, getting involved in processes of creativity, automation, security, and privacy, becoming our best partner. Think of writers like J. K. Rowling, author of Harry Potter, who was able to construct a thrilling story in a magical world, rich in detail. By reading or watching its movies we may experience the Harry Potter universe to a certain extent. Instead, if we want to create our own universe and let people be part actively on it, AI will support us in creating compelling stories like we could do in  like tools, forming more realistic characters with , or speeding up the construction of entire spaces with .
Moreover, it will not only be enough for us to create this new universe, but it should remain attractive and immersive enough, so people want to participate and interact in it actively.  that will help us understand better our users and continue to create memorable experiences for them. However, as it is sensitive information on the playground, the Metaverse will involve Blockchain. As suggested by the authors of the , this technology mix will potentially ensure the transfer of data from each of the users to the Metaverse, to have traceability of who and why the user data has been used and maintain dynamic parameters that reduce vulnerability during encryption.
 

Illustration about the Promethean AI software
 
References
Calandra, C. (2021, 1 julio). Entering the meta realm. Wunderman Thompson. Recuperado 2 de noviembre de 2021, de https://www.wundermanthompson.com/insight/entering-the-meta-realm
Newton, C. (2021, 22 julio). Mark Zuckerberg is betting Facebook’s future on the metaverse. The Verge. Recuperado 2 de noviembre de 2021, de https://www.theverge.com/22588022/mark-zuckerberg-facebook-ceo-metaverse-interview
BBC News. (2021, 18 octubre). Facebook to hire 10,000 in EU to work on metaverse. Recuperado 2 de noviembre de 2021, de https://www.bbc.com/news/world-europe-58949867
Epic Games. (2021, 13 abril). Announcing a $1 Billion Funding Round to Support Epic’s Long-Term Vision for the Metaverse. Recuperado 2 de noviembre de 2021, de https://www.epicgames.com/site/en-US/news/announcing-a-1-billion-funding-round-to-support-epics-long-term-vision-for-the-metaverse
Epic Games. (s. f.). Fortnite and Travis Scott Present: Astronomical. Recuperado 2 de noviembre de 2021, de https://www.epicgames.com/fortnite/en-US/news/astronomical
Wunderman Thompson Intelligence. (2021, 14 septiembre). New trend report: Into the Metaverse. Wunderman Thompson. Recuperado 2 de noviembre de 2021, de https://www.wundermanthompson.com/insight/new-trend-report-into-the-metaverse?j=61174&sfmc_sub=37405083&l=65_HTML&u=4069500&mid=110005021&jb=9008
Ortiz-Ospina, E. (2019, 18 septiembre). The rise of social media. Our World in Data. Recuperado 2 de noviembre de 2021, de https://ourworldindata.org/rise-of-social-media
Radoff, J. (2021, 1 noviembre). 9 Megatrends Shaping the Metaverse - Building the Metaverse. Medium. Recuperado 2 de noviembre de 2021, de https://medium.com/building-the-metaverse/9-megatrends-shaping-the-metaverse-93b91c159375
Kindig, B. (2021, 3 septiembre). The Key To Unlocking The Metaverse Is Nvidia’s Omniverse. Forbes. Recuperado 2 de noviembre de 2021, de https://www.forbes.com/sites/bethkindig/2021/09/02/the-key-to-unlocking-the-metaverse-is-nvidias-omniverse/?sh=62ca37795e17
NVIDIA. (2021, 1 noviembre). NVIDIA OmniverseTM Platform. NVIDIA Developer. Recuperado 2 de noviembre de 2021, de https://developer.nvidia.com/nvidia-omniverse-platform
NVIDIA. (2021a, abril 13). NVIDIA Omniverse - Designing, Optimizing and Operating the Factory of the Future. YouTube. Recuperado 2 de noviembre de 2021, de https://www.youtube.com/watch?v=6-DaWgg4zF8
Safian-Demers, E. (2021, 25 marzo). Augmented living. Wunderman Thompson. Recuperado 2 de noviembre de 2021, de https://www.wundermanthompson.com/insight/augmented-living
Ankers, A. (2021, 19 octubre). The US Army Is Planning a Huge Experiment With Robot Tanks. IGN. Recuperado 2 de noviembre de 2021, de https://www.ign.com/articles/us-army-robot-tanks-experiment-planned?utm_source=twitter
Jeon, H., Youn, H., Ko, S., & Kim, T. (2021, 3 agosto). Blockchain and AI Meet in the Metaverse. IntechOpen. Recuperado 2 de noviembre de 2021, de https://www.intechopen.com/online-first/77823#B1
Fotos
Epic Records [Travis Scott]. (2020, 26 abril). Travis Scott and Fortnite Present: Astronomical (Full Event Video) [Vídeo]. YouTube. https://www.youtube.com/watch?v=wYeFAlVC8qU
Wunderman Thompson Intelligence. (2021a, septiembre 14). Mapping the Metaverse [Gráfico]. Into the Metaverse. https://www.wundermanthompson.com/insight/new-trend-report-into-the-metaverse?j=61174&sfmc_sub=37405083&l=65_HTML&u=4069500&mid=110005021&jb=9008
Our World in Data. (2019, 18 septiembre). Number of people using social media platforms, 2004 to 2018 [Gráfico]. The rise of social media. https://ourworldindata.org/rise-of-social-media
Haboo. (s. f.). [Avatars at the disco in Haboo]. Haboo. https://www.habbo.es/playing-habbo/what-is-habbo
Jeon, H., Youn, H., Ko, S., & Kim, T. (2021, 3 agosto). Relationship between the real world and the Metaverse. [Gráfico]. Blockchain and AI Meet in the Metaverse. https://www.intechopen.com/online-first/77823#B1
Promethean AI. (2021, 5 marzo). Promethean AI Keynote [Ilustración]. Promethean AI. https://www.youtube.com/watch?v=hA0MsGWvmzs",7
