,article_name,content,file_id
17,Interfaces Invisibles. Pensando más allá de las pantallas.,"¿Cómo se ve el futuro de la interacción humano-máquina?
 
Últimamente, la gran pregunta que nos reta todos los días es: ¿cómo podemos hacer que nuestros productos tecnológicos simplifiquen cada vez más la vida de las personas y suplan las limitaciones de la tecnología actual? La idea de llegar a una experiencia agradable y que impacte positivamente a los usuarios desvela tanto a pequeños empresarios como a las grandes multinacionales.
Con el objetivo de empezar a soñar experiencias nuevas, más allá del monitor, el teclado y el ratón; primero, debemos revisar cuál ha sido la historia de la relación humano-máquina para luego – sobre experiencias aprendidas – podamos contemplar las relaciones usuario-interfaz del futuro.
Según lo anterior, este artículo tiene como objetivo hacer un recuento histórico de lo que ha sido tal relación para luego proponer posibles vías de innovación en lo que refiere a este campo, tales como Interfaces invisibles.
 
Un recorrido por la historia de la relación humano-máquina
 

Fotografía por Gilles Lambert en Unsplash
 
La relación entre los seres humanos y las máquinas (acotando la definición de este concepto a la tecnología computacional) data desde 1980, tras la primera ola de computadores personales y de escritorio. Si bien previamente ya existían las interfaces de líneas de comando (CLIs), no fue hasta que las primeras computadoras invadieron los hogares y oficinas que el público general tuvo la posibilidad de interactuar con estos sistemas electrónicos. A partir de ese momento, se democratizó el uso de estas máquinas por medio de las interfaces gráficas de usuario (GUI) y su metáfora del “escritorio”.
Entre 1990 y principios de los 2000, las personas empezaron a utilizar los computadores como medio de comunicación para socializar con los demás, colaborando y difundiendo conocimiento a través del correo electrónico. A esta nueva experiencia se sumaron las mejoras en la sensibilidad de los ratones al tacto y la presión. No obstante, las innovaciones en las GUIs no fueron demasiadas, manteniendo los conceptos de ventanas y archivos junto con el gesto de “arrastrar y soltar” del cursor.
Durante los siguientes 10 años, los usuarios empezaron a interactuar con el contenido digital de manera revolucionaria gracias a las pantallas táctiles y el infinito universo de las aplicaciones. Estas innovaciones permitieron que la tecnología tomara un rol más amplio en la vida de las personas. Por ejemplo, se empezó a usar como una , un medio de autoexpresión y una herramienta de apoyo en procesos de crecimiento personal, moldeando sus hábitos y protagonizando la paradoja de “estar solos pero acompañados”.
Desde entonces, las interfaces táctiles han permeado todos los aspectos de la vida humana. Sin embargo, en el 2011 surge un nuevo tipo de interacciones humano-máquina. Por un lado, están las asistentes de voz y las interfaces conversacionales, las cuales han ganado popularidad gracias a su interacción natural a partir del lenguaje humano. Por otro lado, existen las experiencias inmersivas que le agregan una nueva dimensión a las interfaces al utilizar la totalidad del campo visual humano; y los ambientes inteligentes (AmI), que toman los avances de la IA, la computación ubicua y los sensores sin contacto para crear espacios físicos sensibles y responsivos.
 
¿Cuál es el futuro de las interfaces? La necesidad de una nueva generación de interacciones más humanas
 

Fotografía por Philipp Berndt en Unsplash
 
Al mirar hacia atrás, nos damos cuenta que – durante los últimos 30 años – la relación humano-máquina se ha basado principalmente en interacciones generadas a partir de teclados, ratones y paneles táctiles. Sin embargo, estos periféricos no han logrado cerrar la brecha entre las capacidades computacionales y el comportamiento humano. Por ejemplo, estos siguen presentando inconvenientes al resultar inaccesibles para minorías como los adultos mayores (quienes encuentran las pantallas complejas y ambiguas) y las personas con habilidades especiales (que se frustran tras no poder interactuar del todo). Sin tener que ir más lejos, que estas interfaces involucren mayoritariamente el sentido de la vista, hace que al menos  se vean perjudicados.
A pesar de que las últimas tendencias en tecnología – mencionadas anteriormente – eliminan las barreras físicas y se acercan más a la naturaleza humana, estas sólo corresponden al comienzo de una nueva generación de interfaces. Entonces, ¿cómo sería una relación entre las personas y las máquinas en la que estas últimas entiendan e interpreten los comportamientos humanos físicos y mentales? ¿Qué pasaría si las interfaces permiten una experiencia a partir de los 5 sentidos, percibiendo nuestro cuerpo en el espacio e incluyendo funcionalidades gestuales?
Definitivamente, el siguiente camino de la innovación en interfaces debe salirse de los límites de las pantallas bidimensionales de vidrio, a las que nos hemos acostumbrado. Los nuevos avances tecnológicos deben permitir interacciones más cercanas a la biología humana, favoreciendo que la ejecución de cualquier tarea sea aún más intuitiva y ampliando el espectro de experiencias.
Ahora bien, antes de empezar a imaginarnos un mundo en el que reinen las PVUIs (Projected Visual User Interfaces) o en el que toda solución se inspire en los principios de diseño del HUD (Head-Up Display), considero que se ha de reflexionar acerca de las posibles características que deben tener las relaciones humano-máquina del futuro. Al tomar las propuestas por la startup alemana Senic, a continuación menciono las más relevantes, en mi opinión:
Descentralizadas, interfaces invisibles y mágicas.
Las interacciones se alejarán de las GUI y pasarán a ser omnipresentes, estando siempre donde se las necesite. Éstas harán parte de nuestro entorno, en las paredes o ventanas de la casa u oficina, y darán lugar a escenarios en los que podamos hacer un gesto en el aire para prender la luz de una habitación. Incluso, serán capaces de leer nuestras emociones y entender lo que estamos haciendo para anticipar nuestras necesidades. Esta idea resulta valiosa al permitir que las personas no tengan que sostener una pantalla o bajar la mirada para verla, concentrándose en situaciones más importantes.
Específicas.
Esta es la premisa más beneficiosa y retadora de todas. Pasar de pensar en soluciones que todo el mundo pueda utilizar, como en su momento lo diseñó Steve Jobs, y empezar a ofrecer experiencias únicas para situaciones concretas. Ejemplo de esto sería diseñar interfaces que brinden interacciones hápticas especiales para personas con profesiones en la industria creativa, o que apliquen métodos de aprendizaje basados en la gamificación para niños.
Centradas en los humanos.
Este concepto recalca la necesidad de incursionar con máquinas que perciban, entiendan y procesen tanto el cuerpo como la mente humana desde sus diferentes aproximaciones. Así, esto nos lleva a imaginarnos sistemas que detecten movimientos cerebrales y que entreguen información desde los múltiples sentidos.
Instantáneas.
Aquí, nos cuestionamos si se puede realizar una tarea sin necesidad de pasar por varios pasos, ni siquiera dos o tres. Resolver las actividades humanas al instante y reducir la carga cognitiva de las personas resultará en una mejor y menos estresante experiencia para el usuario.
 
Conclusión
 
Mejorar la experiencia de los usuarios se trata de un trabajo continuo. Siempre habrá más por aprender acerca de las diversas maneras en las que, como seres humanos, nos relacionamos con la tecnología. Las situaciones actuales nos dan la oportunidad de ser creativos y entregar valor al crear experiencias  que no se limiten a las superficies de interacción existentes. Se ha de seguir aprovechando y potenciando las posibilidades que nos aporta la Inteligencia Artificial, con sus capacidades de , o los beneficios que trae consigo la realidad virtual y aumentada. No obstante, se ha de ir aún más lejos y crear experiencias que verdaderamente simplifiquen la vida de todos sin excepción.
 
REFERENCIAS
 
AltexSoft Inc. (2018, 1 julio). Principles of Interaction Design: What It Takes to Create Positive Human-Computer Interactions. Medium. UX Planet. https://bit.ly/3aHjQLF
Asher, M. (2017, 18 julio). The History Of User Interfaces—And Where They Are Heading. Adobe. https://adobe.ly/3tYVHrq
Campbell, C. (2021, 22 enero). Ambient Intelligence — The Invisible Interface. Medium. Start It Up. https://bit.ly/3sUS9VR
Ekenstam, L. (2015, 25 octubre). Magic Leap — The next big frontier in human+computer revolution. Medium. https://bit.ly/2PqWp1R
Kim, A. (2018, 11 julio). What is Human Computer Interaction (HCI)? Medium. https://bit.ly/2R4DzxG
La OMS presenta el primer Informe mundial sobre la visión. (2019, 8 octubre). Organización mundial de la Salud. https://bit.ly/3gMDyJX
Senic. (2015, 8 enero). The Future of Human Computer Interaction. Medium. https://bit.ly/3gH7Eyc
Usabilla. (2017, 15 mayo). A Short History of Computer User Interface Design. Medium. The UX Blog. https://bit.ly/3nmT9Bb
What is Human-Computer Interaction (HCI)? (2021). The Interaction Design Foundation. https://bit.ly/2R1To8o
Xiao, L. (2017, 17 julio). A Brief History of Human-Computer Interaction (HCI). Medium. Prototypr.io. https://bit.ly/3vgHsyo",17
18,Los modelos matemáticos detrás de Machine Learning,"Las soluciones a las que lleguemos pueden ser tan inteligentes como las bases sobre las cuales las construimos
 
Desde el inicio de los tiempos, las ciencias han acompañado al ser humano, quien impulsado por la lógica y la razón que lo caracterizan, ha logrado avances significativos en este campo tan amplio y complejo. Sin ir tan lejos, podemos evidenciar la creatividad y el ingenio humano en un hecho tan simple (aparentemente) como construir un objeto redondo y ponerlo a rodar, tal invención combina ciencias como la física y las matemáticas.
Y es que a medida que la humanidad ha ido avanzando, las ciencias se han ido desarrollando de tal manera que se han convertido en el motor evolutivo del hombre en la sociedad, un gran reflejo de ello son todos los avances tecnológicos que ya hacen parte de la cotidianidad.
En años recientes con el auge de la , hemos visto como las máquinas han sido capaces de aprender y analizar información, el desarrollo de estas capacidades es conocido en las ciencias de la computación como Machine Learning – ML. Así pues, el objetivo de este artículo es explicar cómo en este momento de la humanidad, las matemáticas continúan jugando un papel protagónico (aunque se tenga poca conciencia de ello), en la implementación de Modelos matemáticos detrás de Machine Learning.
 
¿Cuáles son los modelos matemáticos detrás de Machine Learning?
 
Generalmente, se tiene la concepción que para construir modelos de machine learning basta con utilizar aquellos que se encuentran en librerías, con lenguajes de programación predeterminados y que sólo requieren de la acción de introducir la información necesaria.
Lo anterior es totalmente incorrecto, ya que, primero se debe saber qué información es relevante para el correcto funcionamiento de un modelo, pues como dice un conocido dicho dentro de este campo «basura entra, basura sale», y segundo y más importante, no conocer los fundamentos de estas herramientas generalmente, termina en alternativas que al final no van a solucionar ningún problema.
Por tal razón a continuación, desarrollaré los fundamentos a los que hice referencia anteriormente:
 
Álgebra lineal
 
Vectores, ecuaciones lineales, matrices todos estos conceptos son claves dentro del Machine Learning, y obligatoriamente deben conocerse, pues de entrada nos encontramos soluciones donde operaciones cíclicas como un For o While son reemplazadas por operaciones entre matrices, con el fin de buscar eficiencia al realizar estos cálculos, si seguimos avanzando encontramos representaciones de objetos en espacios vectoriales, temas complejos como el análisis de componentes principales (PCA siglas en inglés), en donde a través de operaciones matriciales y proyección de vectores, podemos reducir las características dentro de un análisis.
 

 – Machine Learning
 
¿De qué manera se aplica al mundo real?
 
Para dar claridad a lo anterior tomemos como ejemplo el campo de la psicología de la personalidad; todos tenemos diferentes personalidades y estas tienen diferentes matices, alguien se puede parecer mucho a otra persona en unos aspectos, pero a su vez diferir completamente en otros. ¿Existe alguna manera de cuantificar esto?
Desde hace aproximadamente 100 años se ha intentado dar respuesta a esta pregunta, con resultados que, si bien no acaban de abarcar toda la magnitud de esta incógnita, si han podido representar de manera parcial la personalidad de un ser humano.
Ahora cabe aclarar que dichas interpretaciones siempre se han realizado a través de criterios cualitativos, pero ¿será posible representar la personalidad de alguien de una manera cuantitativa? Para ello tomaremos como referente principal, la hipótesis léxica cuya idea principal se basa en que cualquier rasgo de la personalidad de un individuo siempre debe corresponder a una palabra del idioma, por ejemplo, una persona es valiente, sensible o tímida.
En un principio, psicólogos que se dedicaron al estudio del tema, encontraron alrededor de 4500 palabras que describían los diferentes rasgos humanos, más adelante profesionales de la misma rama se dieron a la tarea de agrupar dichas palabras hasta reducir la cifra a 500. ¿Pero qué ocurre si experimentalmente tomamos estas 500 palabras y les aplicamos PCA?
Lo que obtenemos es la reducción de estas 500 características a 5 rasgos con los cuales se puede clasificar la personalidad de un individuo (extroversión, responsabilidad, neocriticismo, cordialidad y apertura a la experiencia), dichos rasgos son conocidos en psicología como el modelo de los 5 grandes. Una muestra del porque el álgebra lineal jamás pasará de moda.
 
Cálculo diferencial, integral, multivariado
 
Implícito en los otros modelos matemáticos detrás de Machine Learning, resulta bastante útil conocer sobre integrales y derivadas parciales al momento de revisar las funciones de optimización, o para hallar matrices Hessianas, con las cuales podemos encontrar la convexidad de una función, esta característica es muy importante debido a que nos ayuda a elegir o descartar dicha función, así como a su vez para hallar sus puntos mínimos, lo que se traduce a la respuesta más óptima que podemos hallar en dicho procedimiento. Esto también es conocido como un híper parámetro, una variable dentro de una función que a medida que es ajustada hace que el modelo que estamos generando mejore o empeore.
 


Hay que tener en cuenta que cuando hablamos de entrenar modelos, estamos hablando de analizar cantidades gigantes de información, acción que supone tiempo y costos elevados de procesamiento, por lo que responder a preguntas como: ¿cuál será ese número mágico que debemos colocar en nuestro híper parámetro, que hará que nuestro modelo funcione a la perfección?, a través del instinto y experiencia no es suficiente. Se debe conocer la teoría sobre cómo funciona el modelo que estamos aplicando para de esta manera tener la certeza de que lo que estamos haciendo tiene sentido y no hay nada mejor que el cálculo para respaldar este tipo de decisiones.
 
Estadística y probabilidad
 
Gran parte de modelos matemáticos detrás de Machine Learning son o conllevan elementos estadísticos y probabilísticos, de esta manera los conocimientos sobre teoría de probabilidad, combinatorias, teoría de conjuntos, ley de Bayes entre los más relevantes, sirven de aliados para enfrentarnos a los diversos problemas que se nos planteen.
Un ejemplo de lo anterior se ve en los árboles de decisión, una técnica muy popular dentro del ML cuyas raíces están en el teorema de la probabilidad condicional. De la misma manera encontramos las máquinas de soporte vectorial que en palabras coloquiales se pueden definir como algoritmos clasificadores, cuyas respuestas están sustentadas en la probabilidad de que un punto pertenezca a una u otra clase, dentro de un espacio vectorial.


 
Se han preguntado alguna vez de qué manera funciona la predicción del clima o las predicciones demográficas. La respuesta es modelos de series de tiempo, que no es más que la aplicación de
diversos métodos estadísticos tales como estimaciones de tendencias, cálculo de estacionalidad, análisis de correlaciones, entre los más destacados, para un conjunto de datos que se han medido en diferentes etapas del tiempo y están ordenados de manera cronológica. Así sin duda alguna nos podemos referir a la estadística y probabilidad como el núcleo del ML.
 
Optimización
 
El concepto matemático para optimización está basado en unos criterios de selección y un conjunto de elementos, el reto está en hallar el elemento que mejor se ajuste a dichos criterios, siempre teniendo en cuenta la eficiencia del proceso y el uso de recursos, no es lo mismo encontrar un resultado exacto gastándose 3 días en encontrarlo y la capacidad de 10 servidores, a hallar un resultado no tan exacto, pero en 10 minutos y con un solo servidor.
Un claro ejemplo de este tema se da en el Gradiente Descendiente el cual es un algoritmo que aplica técnicas de optimización para encontrar un valor mínimo local dentro de una función. Explicado de una forma sencilla , suponga que usted está caminando en una montaña y de repente la niebla cubre el ambiente, en ese momento, su único objetivo es bajar la montaña para encontrar la planicie, así que precavidamente y paso a paso usted empieza a bajar hasta que en un punto encuentra terreno plano, en este escenario su mínimo local sería el terreno plano, su función seria bajar de esa montaña y el gradiente seria usted mismo pues es quien va recorriendo toda la montaña para encontrar el punto plano.
 


 
¿Cómo podría empezar a aprender del tema?
 
El principal problema que enfrentan la mayoría de las personas que quieren aprender de este campo tan interesante de la AI, es la gran cantidad frentes de acción que tiene, lo que se traduce en aprender sobre conceptos nuevos, herramientas nuevas, temas que a primera vista parecen enredados, pero que en la medida en que se conozcan sus bases, se hacen más sencillos de entender.
Así que, desde un punto de vista más personal, y como recomendación lo mejor es empezar por la raíz de todo, la estadística y probabilidad, para tener un acercamiento a los tipos de problemas que nos enfrentaremos, de allí podremos continuar con un repaso de algebra lineal, la cual me resulta
divertida pero no deja de ser desafiante, siguiendo nuestra hoja de ruta estaría todo lo relacionado con cálculo, tener claros conceptos básicos de derivadas, integrales y dimensiones es lo primordial para así finalizar con optimización que como ya lo vimos anteriormente tiene por dentro álgebra lineal y cálculo.
 
Conclusión
 
Conocer los modelos matemáticos detrás de Machine Learning, nos ayuda en el día a día a resolver cuestiones que son clave dentro de nuestra labor, como, por ejemplo: seleccionar el algoritmo que más se ajuste a nuestro problema, escoger los híper parámetros que mejor se ajustan a nuestro modelo, identificar problemas en los modelos como sesgos o sobre entrenamiento, hallar una función óptima para resolver nuestro problema, entre las tareas de gran relevancia.
Es por lo anterior que este tema es indispensable para alguien que está interesado en aprender de ML. Hay que recordar que, a grandes rasgos estamos intentando construir tecnología capaz de emular tareas y comportamientos humanos, y si no sabemos cómo estamos construyendo estas tecnologías, lo más probable es que las soluciones a las que lleguemos sean tan inteligentes como las bases sobre las cuales las construimos.",18
