,article_name,content,file_id
0,Enhance medicine using AI,"During the last decades, AI transformed multiple fields of knowledge; medicine is not out of this transformation. There are many different ways in which we can enhance medicine using AI. In this article, I will introduce you to some of how AI can help discover new drugs, understand the mysteries of cancer, and learn up to one billion relations between different research resources. 
 

 
The first time AI helped humans research was in 2007 when Adam (a robot) generated hypotheses about which genes code for critical enzymes that catalyze reactions in the yeast Saccharomyces cerevisiae. Adam also used robotics to test its predictions in a lab physically. Researchers at the UK universities of Aberystwyth and Cambridge then independently tested Adam'sAdam's hypotheses about the functions of 19 genes; 9 were new and accurate, and only one was wrong. [1] This is only one example of the multiple applications of AI in this field; get ready to learn more! 
 
From understanding cancer to discovering new drugs 
 
AI is turning the drug-discovery paradigm upside down by using patient-driven biology and data to derive more-predictive hypotheses rather than the traditional trial-and-error approach. For example, Boston's Berg biotechnology company developed a model to identify previously unknown cancer mechanisms using tests on more than 1,000 cancerous and healthy human cell samples.  

Another contribution of AI to this field was made by BenevolentBio when they created a platform that took information from multiple sources such as research papers, patents, clinical trials, and patient records.  
Then this information is used to create a representation, based in the cloud, of more than one billion known and inferred relationships between biological entities such as genes, symptoms, diseases, proteins, tissues, species, and candidate drugs. The inference of those relationships uses Natural Language Processing (NLP) techniques. 
Deepchem is a neural network model based on python used to find a suitable candidate in drug discovery aimed to democratize drug discovery, material science, quantum chemistry, and biology.[2] The Neural Network model used is a multilayer perceptron, a neural network where the mapping between inputs and outputs is non-linear. A Multilayer Perceptron has input and output layers, and one or more hidden layers with many neurons stacked together[3].

 
Uses and advantages 
 
Only in the drug development field there are many applications of AI. In this article [4], the authors mapped the uses of AI in drug discovery: 

As you can see, there are a lot of applications in different fields, only in the drug discovery area. The prediction task has a central role in most of the uses. It is one of the preferred tasks of Artificial Intelligence!  
Developing a new treatment can take over a decade and have an estimated cost of about 2.6-billion dollars. Much of that effectively goes down the drain because it includes money spent on the nine out of ten candidate therapies that fail somewhere between phase-1 trials and regulatory approval. With the right effort, AI and machine learning will usher in an era of optimizing quicker, cheaper, and more effective drug discovery. AI can recognize hit and lead compounds and provide a quicker validation of the drug target and optimize the drug structure design.[4] 

 
 
Some challenges 
 
Despite these promising applications, many scientists are unaware of the capabilities of AI. A survey published in February by BenchSci, a start-up in Toronto, Canada, that provides a machine-learning tool for scientists searching for antibodies, found that 41% of the 330 drug-discovery researchers who took part were unfamiliar with the uses of AI [5].   
AI faces some significant data challenges, such as the data's scale, growth, diversity, and uncertainty. The data sets available for drug development in pharmaceutical companies can involve millions of compounds, and traditional ML tools might not be able to deal with these types of data. In addition, access to data from various database providers can incur extra costs to a company. The data should also be reliable and high quality to ensure accurate result prediction.   
Other challenges that prevent full-fledged adoption of AI in the pharmaceutical industry include the lack of skilled personnel to operate AI-based platforms, limited budget for small organizations, apprehension of replacing humans leading to job loss, skepticism about the data generated by AI, and the black box phenomenon (i.e., how the AI platform reaches the conclusions)[4].
 
To conclude 
 
In spite of all the previously listed challenges, Artificial Intelligence will transform the world in the coming years. If we want to prepare, we have to endure each of these problems. Fortunately, AI is not stopping us from finding solutions and answers to different problems. If we look forward to the future, new tools, such as Quantum Computing, will be available to develop chemical simulations [6]. If you are looking to enhance some processes in the pharmaceutical industry with AI help, don't hesitate to contact us! 
 
References 
 
[1]  
[2]  
[3]  
[4]  
[5] go.nature.com/2xarpt3 
[6]",0
1,La inteligencia artificial en beneficio a la humanidad,"Todos tenemos una opinión frente a lo que es inteligencia artificial (en este blog, lo llamaremos AI). El cine y la televisión, como medios de comunicación masiva, nos ha empapado de historias y personajes relacionados a esta y han construido todo un imaginario frente al tema. Así, podemos tomar como ejemplo el universo cinematográfico de Marvel Studios en el cual nos presenta, por un lado, inteligencias artificiales como Visión, superhéroe cuya mente posee los restos de Jarvis, el asistente personal virtual de Tony Stark, y su contraparte infame Ultrón, robot cuyo objetivo es exterminar la raza humana.
En contraste, dentro de nuestra realidad, podemos pensar en sistemas de AI tales como lo son Siri o Alexa, presentes primordialmente en nuestros celulares para asistirnos, o las controversiales cámaras de reconocimiento facial implementadas en china, cuyo uso generó revueltas en Hong Kong por sentir que este tipo de tecnologías pueden llegar a vulnerar la privacidad de la población.
Con esto en mente, junto a nuestro  nos dimos la tarea de preguntarle a nuestros clientes, amigos y hasta familiares su opinión frente a esta tecnología. Si bien, muchas de las opiniones recalcaban ventajas como agilizar procesos, disminuir errores o procesar grandes cantidades de datos, de igual manera hacían énfasis en que esta tecnología competía, desplazaba y reemplazaba al ser humano, dejándonos a merced de esta sin ningún control. Debido a esto, me parece pertinente que nos preguntemos: ¿Está la Inteligencia artificial en beneficio a la humanidad? Antes de dar una respuesta a esta incógnita, debemos conocer un poco a nuestro sujeto de estudio.
 
Abrebocas a la AI
 
En las ciencias de la computación, la AI es la capacidad de una máquina de tener facultades cognitivas semejantes las de un ser vivo, especialmente a las del ser humano. Según ,  que lleva décadas trabajando en esta área, lo define como la simulación del pensamiento humano a través de modelos computarizados, los cuales le permiten entender, razonar, aprender e interactuar a través del uso de datos. Sin embargo, aunque las máquinas tengan estas facultades cognitivas, ellas realmente no pueden igualar en su totalidad a las de un ser humano. Asimismo, según l, el término AI podemos clasificarlo en 3 tipos: Débil, general, y fuerte.
La inteligencia artificial débil (weak AI o Narrow AI en inglés), es una AI que lleva a cabo tareas totalmente específicas como jugar , dar recomendaciones como lo hace Netflix o poder hablar y dictarle comandos a nuestro celular a través de Siri. La inteligencia artificial general (AGI por sus siglas en inglés), es capaz de tener facultades cognitivas al mismo nivel que un ser humano, por lo que podría tener emociones y llevar relaciones.
Y, finalmente, una inteligencia artificial fuerte (ASI por sus siglas en inglés), es capaz de sobrepasar en todo sentido las capacidades de un ser humano. Por lo tanto, y a pesar de que en los últimos años hemos tenido grandes avances dentro de esta área, es claro que seguimos desarrollando AI débiles.
No obstante, ya hemos comprobado, para bien o para mal, el impacto que puede tener esta tecnología en nuestra sociedad. Por un lado, en el año 2014, la compañía estadounidense  desplegó una AI encargada de llevar a cabo el proceso de reclutamiento y contratación de la empresa con el fin de automatizar y optimizar recursos dentro del proceso. Sin embargo, un año más tarde, el equipo se dio cuenta que esta AI tenía  a la hora de seleccionar los aspirantes, pues castigaba aquellas hojas de vida de mujeres y premiaba al de hombres. Otro ejemplo podemos encontrarlo en el documental Coded Bias, la cual expone que esta tecnología puede llegar a ser sexista, racista y opresora si no se entrena y desarrolla de manera correcta.
Por otro lado, tenemos los casos en los que los coches de la marca , los cuales cuentan con un sistema AI de piloto automático, se han visto envueltos en graves accidentes debido al mal uso de este sistema ya que se ha demostrado que estos sistemas no son capaces de responder eficientemente a las condiciones normales necesarias para una conducción real. Por ende, si estas AI débiles están teniendo un impacto adverso para el ser humano, ¿por qué continuar usando esta tecnología? ¿qué mundo distópico nos espera cuando lleguen las AI fuertes?
 
La importancia del diseño en la AI
 
En el caso de Amazon, el equipo técnico y los diseñadores que construyeron esta AI debieron tener en cuenta qué partes de todo este proceso se podían automatizar, dónde intervenía el ser humano y no dejar que la máquina sea quien tome la decisión y defina quien debe ser contratado y quien no. Aun así, el equipo debió tener un entendimiento del contexto, ya que los datos con los que entrenaron a este sistema eran datos que demostraban el sesgo y la preferencia de contratación desigual en género que Amazon desde el 2014 quería empezar a combatir. Por otro lado, Josh Lovejoy en su artículo  describe los alcances actuales de la AI como “esenciales pero insuficientes por sí solas”, puesto que a las AI son una tecnología que tiene un aprendizaje similar a la de un niño. ¿Le daríamos total control a un niño para que maneje nuestros vehículos en las calles de nuestra ciudad? Esto nos lleva al caso de tesla, donde la falta de entendimiento de los usuarios hacia los alcances de esta tecnología, el poco análisis y prevención del comportamiento adverso que tendrían los clientes fue lo que ha ocasionado los graves accidentes que, en algunos casos, han causado muertes.
Repasando estos y otros casos de AI adversas se percibe levemente la falta de un componente que, de haberse tenido en cuenta, hubiesen tenido un mejor impacto: diseño centrado en el ser humano.
Si bien, los sistemas de AI han ganado popularidad abriendo las puertas a las distintas industrias de conocer a fondo a sus clientes, tener una mayor capacidad de análisis de estos para captar y mantenerlos, ¿Está la Inteligencia artificial en beneficio a la humanidad de  los clientes, usuarios, seres humanos? Como lo describió mi compañero Manuel en su blog titulado , el uso de metodologías de diseño centrado en el humano permite abordar problemas complejos y que respondan a la pregunta: ¿cómo podemos hacer del mundo un lugar mejor? A través de esta podemos desarrollar inteligencia artificial en beneficio a la humanidad, con propósito humano y que trasciende de la perspectiva simple de negocio.
Usar esta metodología abre los ojos de quienes participan en el desarrollo de sistemas de AI donde, por un lado, nos hace conscientes para discernir cuándo interviene una AI, cuándo un ser humano, o cuándo deben colaborar ambos; y, por otro lado, permite planear y prevenir los posibles impactos éticos, morales, sociales, culturales y económicos que puede llegar a tener dentro y fuera de quienes usarán la AI.
 
La Inteligencia artificial en beneficio a la humanidad
 
Dentro de , nuestro grupo de AI, promovemos la colaboración equilibrada entre el humano y la máquina, la cual tiene como resultado no solo la automatización de tareas repetitivas, peligrosas o poco agradables para las personas, sino que pretende aumentar y potenciar nuestras capacidades humanas. Wildlife Insights es un proyecto que ejemplifica estos valores. Esta es  en la que investigadores pueden monitorear, analizar y compartir datos en tiempo real sobre el estado de la vida silvestre a nivel global. Esta usa trampas y sensores para adquirir datos y usan AI para clasificar los distintos animales encontrados dentro miles de fotos, permitiendo a los científicos concentrar sus esfuerzos en planear y tomar acción para la conservación de los ecosistemas a nivel global. Otro ejemplo por destacar es , una plataforma creada por investigadores de  que proporciona análisis de radiografías al instante, indicando al usuario qué enfermedad ha detectado, en qué área concentra su predicción y con qué porcentaje de confiabilidad presenta su análisis.
 
Conclusión
 
El propósito de este blog era ir más allá de explicar o mostrar ejemplos de cómo con AI podemos captar y analizar a profundidad las dinámicas entre el cliente y nuestro negocio. Más bien, es una invitación a nuestros pares dentro de la industria y clientes que no debemos construir AI sin un sentido, o por moda. Quiero resaltar la importancia de construir AI con propósito y responsabilidad, manteniendo siempre el componente humano en mente. Finalmente, ¿Está la Inteligencia artificial en beneficio a la humanidad? Solo si desde ahora construimos nuestro futuro con responsabilidad.
 
REFERENCIAS
 
IBM Design for AI. (s. f.). Recuperado 18 de abril de 2021, de 
Education, I. C. (2021, 7 abril). Artificial Intelligence (AI). IBM. 
(2018, octubre). Artificial Intelligence Driven Design (N.o 1). Awwwards.books. 
(s. f.). IBM100 – Deep Blue. Recuperado 18 de abril de 2021, de 
India, S. (2019, 5 noviembre). How Netflix’s Recommendation Engine Works? – Springboard India. Medium. .
Saini, K. (2021, 4 febrero). Natural Language Processing ft. Siri – MyTake. .
BBC News Mundo. (2018, 11 octubre). El algoritmo de Amazon al que no le gustan las mujeres. 
Bogen, M. (2019, 15 octubre). All the Ways Hiring Algorithms Can Introduce Bias. Harvard Business Review. 
Kantayya, S. (productor) y Kantayya, S. (director). (2020). Coded Bias [Documental]. EU.: 7th Empire Media.
Kolodny, L. (2021, 19 abril). «No one was driving» in Tesla crash that killed two men in Spring, Texas, report says. 
Lovejoy, J. (2021, 22 enero). When are we going to start designing AI with purpose? 
Ortiz, M. (2021, 8 abril). Impacto del Design Thinking en las diferentes industrias – HOLISTIC – Design Lab. Holistic Design Lab. 
Wildlife Insights. (s. f.). Wildlife Insights. Recuperado 18 de abril de 2021, de 
Conservation International. (s. f.). Wildlife Insights. Recuperado 18 de abril de 2021, de 
(productor) y Wolff, T. & Yogeshwar, R. (directores). (2019). ¿De qué es capaz la inteligencia artificial? [Documental]. Alemania.: DW.",1
